Name,Hours,Location,isFeatured,isNew,Description,Logo,Category
Color plus,All week days - 11am to 10pm.,Skyzone Ground Level,,,"+912224966067 / 9324652233 ,cbtlhspmum@panindiafoods.com",,Mens Fashion
Copper Chimney,All week days - 11am to 10pm.,Courtyard,,,"Timeless craft of Great North Indian Cuisine - that is Copper Chimney for you !! Declared as the undisputed capital of authentic north Indian cuisine by food lovers, Copper Chimney has been Mumbais foremost culinary landmark.The signature dishes include Chelo Kebab, Jinga Nisha,Vegetable Kheema, Benarasi Pulao that have been prepared with our trademarked spices and mixes.",,"Cafes, Restaurants , Desserts"
Costa Coffee ,All week days - 11am to 10pm.,Skyzone First Level,,,Costa Coffee - A Haven for Coffee lovers a perfect lace for conversation over coffee. Every single Costa store/staff is professionally trained in the art of coffee making by our experts. Costa Coffee promises you a perfect cup of Costa coffee every time you visit.,,"Cafes, Restaurants , Desserts"
Cotton World,All week days - 11am to 10pm.,GG Connect,,,"Cotton World is Indians first store dedicated to natural clothing, offering a variety of comfortable and quality rich clothes for men , women.",,General Fashion
Cream Centre,All week days - 11am to 10pm.,Skyzone First Level,,,"Cream Centre has transcended generations to emerge as the leading vegetarian restaurant with all-time favorites and inventive culnary innovations in an inviting ambience to a discerning clientele. Cream Centre first claimed its fame with its still best selling dish, The Original Channa Bhaturas and other Punjabi dishes. The restaurant has adapted to changing trends and created original dishes like the Worlds Best Nachos  Mera Chhota Sizzler, Mera Thali and Sizzling Brownie Fundae ",,"Cafes, Restaurants , Desserts"
Crocs,All week days - 11am to 10pm.,Skyzone Ground Level,,,The international brand for its unusal shape in footwear Crocs provides a good option for those looking for the wet weather and casual wear with bold and bright colours. The store stocks for the entire family including children and toddlers alike.,,"Foot Fashion, Bags, Luggage , Accessories"
CROMA,All week days - 11am to 10pm.,Grand Galleria,,,"Opened in Dec 2008, the High Street Phoenix store of Croma, The Electronics Megastore has catered to and delighted myriads of customers by satisfying not just their electronics needs but also by providing them a world class shopping experience through our 15,000 sq.ft. of great shopping ambience, wide range of products, robust after sales service and our trained and knowledgeable sales executives who help consumers make informed purchase decisions. Croma is owned and run by Infiniti Retail Limited, a 100% subsidiary of Tata Sons. Woolworths Ltd, the Australian retail giant, provides technical support and strategic sourcing facilities from its global network.",,"Electronics, Gizmos , Gadgets"
Da Milano,All week days - 11am to 10pm.,Palladium Third Level,,,"Chic, fancy and very handy handbags, Da Milano provides quality and classy bags and accessories for women.",,"Foot Fashion, Bags, Luggage , Accessories"
Daniel Hecter,All week days - 11am to 10pm.,Palladium Third Level,,,The renowed brand for men in semi formal formal and casual wear.,,Mens Fashion
Davidoff,All week days - 11am to 10pm.,Palladium Third Level,,,"We remain loyal to Zino Davidoff’s demanding and innovative principles which built the brand and created the myth of Davidoff. This is not only the heritage bestowed upon us by Zino, it’s the map that guides us on our quest forward. The Davidoff philosophy means finding true luxury in living passionately and intensely, living every moment fully, to the limit. The world is a borderless wonderland, full of never-ending inspirations and opportunities to bring together the finest materials and ingredients. It is this passion for exploring the new, uncovering and discovering the ultimate in design, craftsmanship and innovation that underscores Davidoff bedrock belief - because life is too precious for compromise, only the best will do. Zino Davidoffs vision and principle to travel the world in quest for inspiration and his commitment to offer ultimate quality is embodied by every product bearing Davidoff brand name. Zinos pure pleasure in life, his spirit and in-depth expertise combined with his special ability to treat every customer with special attention, contributes to the companys global success. Davidoffs prime focus has always been quality. Forever determined to offer the best, inspirations from all over the world are translated into products of perfection. Expertise and passion are an integral part of the development process which emphasizes the uniqueness. Elegant understatement, iconic design and premium ingredients combined with perfect craftsmanship: these are the fundamental characteristics of all Davidoff products, which support the holistic and mobile lifestyle of todays cultivated global citizens.",,"Home Decor / Accessories, Gifts , Hobbies"
Dessange Paris,Opening Soon,Skyzone Level One,,,"No1 “Huate Coiffure"" in the world as it’s rightly called; DESSANGE is undoubtedly world’s leading International salon and spa with around 2000 salons in 47 countries. Femininity, elegance and charm - three words define the world of DESSANGE, a house of luxury dedicated to womens beauty. Aiming to offer state of art, a global concept of beauty that combines the elegance, personality and quality of a genuinely tailor-made offering, Dessange Paris opened its gates in Mumbai with two signature salon located at Kemps corner and Bandra and will soon be opening its third signature salon at High Street Phoenix, Lower Parel. This salon and spa expertise extends to the core of the brands product ranges, with hair care, make-up, face and body care formulas that offer every woman a glamorous aura, a sensory experience and a professional result.",,"Cosmetics, Salon, Spas , Optics"
Diesel,All week days - 11am to 10pm.,Palladium Ground Level,,,"Diesel S.P.A. is an Italian design company. It is best known for luxury, pret-a-porter clothing aimed at the young adult market, particularly jeans. The Diesel store is now open at The Palladium.",,General Fashion
DKNY,,,,,,,Womens Fashion
Dominos,All week days - 11am to 10pm.,Courtyard,,,"The current Dominos menu features a variety of Italian-American entrees and side dishes. Pizza is the primary focus, with traditional, specialty and custom pizzas available in a variety of crust styles and toppings. Additional entrees include pasta bread bowls and oven-baked sandwiches. The menu offers chicken side dishes, breadsticks and salads, as well as beverages and desserts.",,"Cafes, Restaurants , Desserts"
Dune London,All week days - 11am to 10pm.,Palladium Second Level,,,"The Dune Group is one of the most influential global players in fashion footwear and accessories. Founded in 1992 in London, Dune has rapidly expanded to include over 300 outlets across UK, Europe, Russia and the Middle east, as well as online. Our unique collections are all beautifully designed in-house offering a style for every occasion, and are adored by celebrities and fashionistas with a flair for style, highest expectations in quality and attention to detail. The Dune range of men’s and ladies footwear, bags and accessories is the epitome of affordable luxury.",,Mens Fashion
E Dresses,All week days - 11am to 10pm.,Palladium HSU Ground Level,,,"We dream big and never settle for the status. Our focus is to provide best service to the customers with Hi-tech accessories that look as good as they function. Incorporated in 2013, one of the leading of various Hi -tech mobile accessories and digital media. company founder Mr. Ashish Thakkar he has one of the best experience in the field of hi-tech Lifestyle Gadgets and many more.......",,"Electronics, Gizmos , Gadgets"
Ed Hardy,All week days - 11am to 10pm.,Palladium Third Level,,,"Ed Hardy is an internationally recognized brand and enjoys the status of a cult classic with massive fan following. An alternative lifestyle brand at its core, the brand celebrates classic American tattoos as an art form. Don Ed Hardy is considered by many to be the Godfather of Tattoo. His work offers timeless and a distinct artistic appeal. The mission of the brand is to stay true to the essence of Don Ed Hardy’s vision for his art, and celebrate its history and beauty by creating dynamic apparel and related lifestyle products. Ed Hardy offers Menswear across various categories including Shirts, T-shirts, Jeans, Jackets, Trousers and Shorts. The brand has recently launched its Womenswear range.",,General Fashion
Emporio Armani,All week days - 11am to 10pm.,Palladium Ground Level,,,"The label features ready-to-wear and accessories. Emporio Armani is available in its 13 stores in the U.S. and over 140 worldwide,and on the brands website. In January 2010, famed football star Cristiano Ronaldo and Hollywood movie star Megan Fox became the male and female face and body of Emporio Armani. The store is now open at The Palladium.",,General Fashion
Episode,All week days - 11am to 10pm.,Grand Galleria,,,"Episode, Indias premiere silversmiths, wallow its presence at Mumbais most adored retail space High Street Phoenix. Exemplifying luxury, Episode vintage in silver design and craftsmanship can be traced back to 1882. The store offers a large variety of silver , brass designs for ones home, gifting and for the corporate. Episode offers the same quality and design as it sells to its international clients like Armani, Lambert, Ralph Lauren, etc. Products include table and serve ware, uniquely designed deities like Ganeshas, decorative products like candle stands, vases, personal gifts as well as articles for your bar. The baby range is unique in itself. Custom made wedding invites for bridal trousseau, return gifts are among episodes vast repertoire of exclusive designs in silverware.",,"Home Decor / Accessories, Gifts , Hobbies"
Ermengildo Zegna,All week days - 11am to 10pm.,Palladium Ground Level,,,"Known for its bespoke suits, Italian luxury menswear retailer Ermenegildo Zegna specializes in off-the-shelf and custom-made shirts and suits.",,Mens Fashion
Estee Lauder,All week days - 11am to 10pm.,Palladium Second Level,,,"""Every woman can be beautiful.""- Estée Lauder Estée Lauder is one of the world’s most renowned beauty companies. Our skincare, makeup and fragrance products are innovative, technologically advanced and proven effective. Estée Lauder has earned a worldwide reputation for elegance, luxury and superior quality, and our products are sold in more than 140 countries and territories. For over 60 years, we have stayed true to the unshakeable belief that inspired Mrs. Estée Lauder to found her company in 1946: the belief that every woman can be beautiful. Today, that simple notion has literally changed the face of the beauty business. Welcome to the world of Estée Lauder.",,
Ethos Summit,All week days - 11am to 10pm.,Palladium,,,"Ethos Watches is Indias largest chain of luxury watch boutiques, with 44 stores across 14 cities. Founded with the vision to be the biggest and finest retailer of premium and luxury watches in India, Ethos incorporates exemplary ethical and customer service standards. With a well-balanced and diverse portfolio of men’s and women’s timepieces, we are leaders in the Indian watch industry. Influenced by the world of luxury and culture, Ethos curates the best of the world’s iconic watch brands, including Rolex, Cartier, Omega, Breitling, IWC, TAG, Blancpain, Carl F. Bucherer, Longines, JLC and Rado, amongst others. Through our commitment to customer service, Ethos brings sophistication, style advice and knowledge to watch enthusiasts across India. Our stores are located at Mumbai, Bangalore, Chennai, Hyderabad, Delhi, Gurgaon, Chandigarh, Pune, Ahmadabad, Nagpur, Aurangabad, Bhopal, Surat and Ludhiana. Ethos also has a strong presence in travel retail, with airport stores at Delhi - International and Domestic, Bangalore ,International, Mumbai ,Domestic, Hyderabad ,International and Domestic and Ahmadabad –Domestic. Launched in 2012, www.Ethoswatches.com is a niche, one-of-a-kind portal. With over 6000 spectacular watches on display - each meticulously segregated by filters including Brand, Price, Gender, Movement, Case Material, Strap Type and Water Resistance, to name a few, and over 50 luxury brands, watch enthusiasts are offered a varied collection to choose from. The website clocks over 360,000 visits and 1.8 million page views and over 12,000 calls received by the Luxury Watch Helpline every month. The unique watch concierge service is the country’s only ‘luxury watch helpline where customers can dial in and speak with exclusive ‘Luxury Watch Consultants for assistance in choosing a premium timepiece. For more details, visit ethoswatches.com.",,"Watches, Jewellery , Fashion Accessories"
Fab India,All week days - 11am to 10pm.,Grand Galleria,,,"Fab India is Indias largest private platform for products that are made from traditional techniques, skills and hand-based processes. Fab Indias products are natural, craft based, contemporary, and affordable.",,General Fashion
Faces,All week days - 11am to 10pm.,GG Connect,,,"High Street Phoenix presents Faces a store that offers an exclusive line of Cosmetics just in time for the festive season. With a proud Canadian heritage spanning 40 years, FACES Cosmetics offers an exclusive line of makeup, skincare products and personal care accessories. FACES operate a state-of-the-art R,D and product testing facility at Toronto, while its products are manufactured in North America and Asia. Not tested on animals, FACES products are hypoallergenic and conform to the most stringent quality and safety requirements.",,"Cosmetics, Salon, Spas , Optics"
FCUK,All week days - 11am to 10pm.,Palladium Second Level,,,"Founded in 1972 by Stephen Marks, French Connection, the edgy, attitudinal, high street British fashion brand set out to create well-designed and fashion-forward clothing with a quirky spin on design.",,General Fashion
Food Hall,All week days - 11am to 10pm.,Palladium Third Level,,,"The supermarket for gourmet food, fruits and vegetables , ready-to eat meals and snacks, beverages and dairy products plus a whole lot more can be shopped here.",,"Hypermarkets, Supermarket , Gourmet"
FOREST ESSENTIALS,All week days - 11am to 10pm.,Palladium Second Level,,,"Pure natural body products that include scrubs, moisturizers, exfoliaters, bath crystals, conditioners and oils, Forest Essentials provides them all. An excellent options for gifting to oneself and loved ones.",,"Cosmetics, Salon, Spas , Optics"
Forever New,All week days - 11am to 10pm.,Skyzone First Level,,,"Forever New ensures customers are always able to find the latest must have items to add to their wardrobe, with prices to suit every budget.",,Womens Fashion
Fossil,All week days - 11am to 10pm.,Palladium HSU Ground Level,,,"Fossil Group Inc. (NASDAQ: FOSL) is a global company specializing in the design, innovation, and marketing of fashion lifestyle and accessory products. At the heart of Fossil’s vision is a commitment to fostering creativity and delivering the best in design through the company’s namesake FOSSIL brand and a portfolio of internationally recognized owned and licensed brands. The FOSSIL brand is rooted in authenticity and a distinctive modern-vintage design aesthetic. With nearly 400 stores worldwide and a strong global e-commerce business (www.fossil.com). Fossil is internationally known for its eclectic assortment of lifestyle and accessory items including watches, jewellery, handbags, and clothing. The company is constantly developing its multi-brand portfolio through its core competencies in innovative branding, world-class design, and dynamic global distribution",,"Watches, Jewellery , Fashion Accessories"
Furla,All week days - 11am to 10pm.,Palladium First Level,,,"Italian brand Furla is known for its exclusive range of of leather handbags, shoes and accessories small leather goods such as belts, wallets and purses.",,"Foot Fashion, Bags, Luggage , Accessories"
Gajalee,All week days - 11am to 10pm.,Courtyard,,,"Each restaurant provides a rich , unique course of coastal cuisine, prepared by expert chefs, who are true masters in their craft. In fact, some of the culinary innovations at Gajalee have gone on to become household names including the Bombil Fry (Bombay Duck), the Clam Koshimbir , the Prawns Pickle.",,"Cafes, Restaurants , Desserts"
Gangar Eyenation,All week days - 11am to 10pm.,Sky Zone First Level,,,"High Street Phoenix in Lower Parel has always been associated with up-marked brands, style and high fashion! And now, it has another feather in its cap. Gangar Eyenation, easily Mumbais most stylish eyewear store has opened its swanky doors in Lower Parel at High Street Phoenix. What started off as a one-store dream has now emerged into a trendy chain of 44 stores located all across Mumbai, Pune and Gujarat? Gangar Eyenation has certainly done the metropolis proud with its unique growth story. With the launch of this High Street Phoenix store, Gangar Eyenation has clearly emerged as the one-stop shop for trendy Mumbaikars looking for the most contemporary spectacles, contact lenses, sunglasses, powered sunglasses and eye care advice. About GANGAR EYENATION Gangar Opticians Pvt. Ltd. has established themselves as one of the countrys top opticians with over 4 decades of experience in eyewear solutions. We established in 1977 and are promoted by the Gangar’s, India´s most respected and well known optician family. With a trusted family name behind us, this professionally-managed brand has transformed itself into a fast growing and rapidly expanding chain of eyewear solutions. Today, Gangar Eyenation has grown from a single store to one of the largest chains of eyewear solutions with over 40 stores in Mumbai, Pune, Surat , Vadodara",,"Cosmetics, Salon, Spas , Optics"
GANT,All week days - 11am to 10pm.,Palladium Second Level,,,n/a,,Mens Fashion
GAS,All week days - 11am to 10pm.,Courtyard Ground Floor,,,"We have been running for the last thirty years. We have sped up and we have slowed down. We have succeeded and we have outdone ourselves. We have fallen down and we have picked ourselves back up again. We have not stopped a second giving you the purest and most innovative denim, catalyser of a timeless total look. Grit, dynamism, determination and a pinch of (lucid) folly are the values that have been crucial to overcoming the difficulties and achieving the successes that have marked GAS’s 30 years. A link between denim and the world of bikers, inseparable since the days of the legendary ""rebels"" An attitude that we also find in sport, especially in motorcycling, and whose riders are a constant source of inspiration. A relationship that has acquired a very special value for GAS during its long partnership with the world’s leading motorcycle manufacturer and its Repsol Honda MotoGP team, 2013 World Champions with the baby champ, Marc Márquez.",,General Fashion
Gelato Italiano,All week days - 11am to 10pm.,Courtyard,,,"Gelato is an ancient Italian frozen dessert, a far more recent variant of which is ice cream. As such, gelato is made with some of the same ingredients as most other frozen dairy desserts. Milk, cream, various sugars, flavoring including fruit and nut purees are the main ingredients.",,"Cafes, Restaurants , Desserts"
GLOBAL DESI,All week days - 11am to 10pm.,Palladium Third Level,,,"Brought to you by well know Indian fashion designer- Anita Dongre, brings classic and premium Indian wear for women.",,Womens Fashion
GOSSIP,All week days - 11am to 10pm.,Palladium Third Level,,,"Step in for some interesting and classy choices in footwear for men, women and children.",,"Foot Fashion, Bags, Luggage , Accessories"
Gucci,All week days - 11am to 10pm.,Palladium Ground Level,,,"Founded in Florence in 1921, Gucci is one of the worlds leading luxury fashion brands.",,"Foot Fashion, Bags, Luggage , Accessories"
Guess,All week days - 11am to 10pm.,Palladium First Level,,,"Guess, the premium apparel and accessories brand for men and women was established in 1981. GUESS began as a jeans company and has since successfully grown into a global lifestyle brand. Today GUESS designs, markets and distributes full collections of women and men apparel as well as accessories. The store is now open at The Palladium.",,General Fashion
Guess Accessories,All week days - 11am to 10pm.,GG Connect,,,"High Street Phoenix launches the Guess Accessories Store this season at the Grand Galleria and presents two exciting collections as well. To slake the shopping needs of every girl, Guess Accessories presents: The GUESS Jewellery Spring 2011 Collection, and the GUESS Dynamite Leo collection of animal print arm candies. The Guess Jewellery Spring 2011 Collection, is all about dramatic pieces with playful styles that are sure to be must haves in any girls accessory shopping list. This collection has the perfect assortment to represent the young and innocent side of every Guess Girl. Trust this fresh collection to become your latest crush!",,"Watches, Jewellery , Fashion Accessories"
Haagen Dazs,All week days - 11am to 10pm.,Food Court,,,"Haagen-Dazs offers the purest and finest ingredients in the world and crafts them into the best ice cream, sorbet and frozen yogurt available. Come treat yourself to the finest ice cream desserts at Haagen-Dazs!",,"Cafes, Restaurants , Desserts"
Hackett London,All week days - 11am to 10pm.,Palladium Second Level,,,"We pride ourselves on having our own point of view on menswear, based on authentic British style. With a worldwide reputation for designer menswear, personal tailoring and accessories, we are the home of essential British clothing and style.",,Mens Fashion
Hamleys,All week days - 11am to 10pm.,courtyard,,,"Hamleys is one of the worlds largest toy shops. It stocks toys and gifts for children of all ages. Considered a haven for children, they boast of everything from soft toys to video games.",,"Books, Music, Toys , Games"
Harman Kardon,All week days - 11am to 10pm.,Grand Galleria Ground Level,,,"Harman Kardon, a unit of Harman International Industries, Incorporated, designs and builds audio equipment for consumers and the automotive industry. Harman Kardon focuses tightly on the needs of listeners. It applies the stratospheric standards of the most finicky audiophile to DVD players, audio/video receivers and other sound systems that anyone can use easily.By integrating the highest audio standards into sleek and simple-to-use products, Harman Kardon delivers a listening experience like no other. Today, in every Harman Kardon product you will not only find the most innovative, technologically advanced audio solution, you willfind a caliber of industrial design and user interaction that makes itan objet d’art within the modern home. But this is not a case of equaldedication to both audio and form. We believe they are inseparable.",,"Electronics, Gizmos , Gadgets"
"Heel , Buckle",All week days - 11am to 10pm.,Palladium level 3,,,"Launched as a bespoke studio in London’s Hampstead, in 2011, Heel , Buckle has since its inception, had one overriding objective: to bring to its customers footwear that is distinctive not just in terms of its style and look, but also exceptional with regards to quality. Now in our retail avatar, we personally select all the designs we stock and specifically customise them for the markets we operate in - so rest assured that when you shop at Heel , Buckle, the shoes you purchase will be unmatched in their style quotient and reflect a level of elegance that only results from the passionate effort we put in at everything we do at Heel , Buckle. Being a multi-brand concept footwear label, we have the advantage of scouting global trends and brands, and stocking only those designs we find worthy of our discerning clientele. So go ahead and acquaint yourselves with Heel , Buckle, and remember: elegance begins with the shoes. ",,"Foot Fashion, Bags, Luggage , Accessories"
Helios,All week days - 11am to 10pm.,GG Connect,,,"Helios the high-end multi-brand watch chain houses over 40 premium international watch brands. Launched by Titan Industries, Indias largest watch manufacturer, Helios provides a buying experience unparalleled in the Indian context and triggers the taste-buds of the most discerning watch connoisseur. Providing a premium buying and watch owning experience for the global Indian through the international premium watch brands the store has in-store knowledgeable consultants whose will help you in choose from over 40 international watch brands including Versace, Emporio Armani, Roberto Cavalli, Paco Rabanne, Baume , Mercier, Movado, Hugo Boss, Fossil, FCUK, Titan, Xylys, DKNY, Nina Ricci, Esprit, Tommy Hilfiger, Citizen, Seiko, etc.",,"Watches, Jewellery , Fashion Accessories"
HiDesign,All week days - 11am to 10pm.,Palladium Third Level,,,"Hidesign has grown into a global brand recognized for its quality, ecological values and personalized service. By keeping its focus on a classic contemporary look, Hidesign caters to the savvy and sophisticated urban professional. The leather collection includes handbags, clutches, briefcases, laptop cases, wallets, belts and garments.",,"Foot Fashion, Bags, Luggage , Accessories"
Hugo Boss,All week days - 11am to 10pm.,Palladium Ground Level,,,"Formal wear for men including accessories for men, Hugo Boss provides wonderful options for men in the category.",,Mens Fashion
